{
  "_comment": "Declared inventory of what this repository publishes THROUGH THE THREE GOVERNED SURFACES listed in coverage.governs, and of the derived files that must agree with it. It is NOT an inventory of every published byte: 179 files under public/ are tracked and deployed and this file names 30 of them; the remaining 149 are covered by a checked disjointness rule (T9), not by enumeration. WHAT THIS GUARANTEES TODAY: nothing is generated FROM this file at runtime yet. deploy/feed-excludes.txt, .gitignore and scripts/push-to-web-host.sh are still hand-maintained and are still what the deploy and the push actually obey. All this file buys, as of C1 Phase 0, is that scripts/deploy/render-publication.sh can reproduce those three regions byte-for-byte from here, and tests/publication-registry/ fails if it ever cannot. That is a detector, not an enforcement: a hand edit to one of those three files that is NOT mirrored here turns the test red, but nothing stops the edit from being made or deployed. Turning consumers around to read this file is C1 Phase 1 and later.",
  "schema_version": 1,
  "recorded_at": "2026-08-07",
  "spec": "docs/superpowers/specs/2026-08-06-single-source-of-truth-design.md (C1)",

  "kind_definitions": {
    "_comment": "The taxonomy is defined by ONE measurable question: can these bytes change without a commit to this repository? That question is what decides whether a sha256 pin in a signed manifest can survive, which is the only thing the kind gate acts on.",
    "stream": "Content can change without any commit — host cron, runtime push, or an operator writing straight to the public tree. A pin taken at signing time goes stale on its own. MUST NOT appear in pinned_by.",
    "record": "The URL's NAME is derived from a digest of the content it addresses, so whatever that digest covers cannot change without the name changing too. Safe to pin. CORRECTED 2026-08-14 — this read 'Immutable once written, at a URL that never resolves to different bytes', which is stronger than any record this repository actually publishes. A name binds only what its digest covers, and that need NOT be the whole file: for api/archive/ it is the three DAG branches and not the provenance fields sitting beside them, and the generator overwrites an existing archive unconditionally. What binds every byte is the sha256 in the signed manifest, as of signing. Read the row's record_caveat for how far a given name reaches before pinning on the strength of this kind alone.",
    "static": "Changes only when a commit in this repository changes it, and is delivered by the git deploy. Safe to pin, on the condition that the commit which changes it also re-issues the pin — that condition is what scripts/check-identity-pins.sh enforces.",
    "_kind_is_the_floor": "kind is the SAFE FLOOR, never a summary. A consumer that reads only .kind and nothing else must always end up doing the safe thing, so a path is classified by its WEAKEST moment, not its typical one. Qualifier fields (becomes_record_after, record_caveat) may only WIDEN what a consumer that understands them may do; they never narrow what .kind already permits, and a consumer that ignores them stays correct. This is why api/peers-history/ is kind=stream even though every snapshot older than the current UTC day is immutable: at any instant one member is being rewritten, and a consumer pinning on the strength of .kind alone would pin exactly that one."
  },

  "coverage": {
    "_comment": "Read this before treating this file as a source of truth for anything. It is deliberately placed above the data.",
    "governs": [
      "deploy/feed-excludes.txt — the whole file",
      ".gitignore — only the '# ---- Runtime-generated site data ----' section, from that header to the line before the next '# ---- ' header",
      "scripts/push-to-web-host.sh — only two regions: the 'Allowed targets' header comment table, and the flat-filename case pattern line"
    ],
    "does_not_govern": [
      {
        "surface": "The rest of the tracked public/ tree (HTML pages, CSS, JS, images, fonts) — everything under public/ that is neither public/api/* nor public/.well-known/*.",
        "measured": "149 files: git ls-files public/ = 179 total, git ls-files public/api/ public/.well-known/ = 30, and all 30 of those ARE enumerated in publications[] (T16 fails if that stops being true in either direction). 179 - 30 = 149 unenumerated, 2026-08-07.",
        "why_excluded": "They have exactly one owner (the git deploy), are never pushed, and are never pinned, so there is no lock-step obligation for a registry to hold. tests/publication-registry/ checks the claim rather than assuming it: T9 asserts every tracked file under public/ is disjoint from every feed exclude and every push name, so any of the 149 that ever acquires a second owner is named by a failing test. T16 separately asserts that the two prefixes this file DOES claim (public/api/, public/.well-known/) are enumerated exhaustively — adding a tracked file under either without a row here is a failure."
      },
      {
        "surface": "/etc/cron.d on the validator host — the cron files that actually invoke the producers.",
        "measured": "Seven cron basenames have a creating installer in this repo (metal-host-advance, metal-anchor-watch, metal-anchor-publish-health, metal-identity-pins, metal-host-drift, metal-watch-validators, metal-pulsevm-watch — grep of scripts/install-*.sh for cron.d/, re-measured 2026-08-17 when metal-pulsevm-watch landed; the same grep returned six on 2026-08-07). NONE of them produces a publication listed here. Of the 21 push-owned publications (publisher push / push-subdir / push-out-of-band), 17 name a cron and ALL 17 carry owner.cron_installer_in_repo=false, i.e. zero of them have a repo-verifiable command body. The other 3 — api/anchor-receipt.json, api/anchor-history.jsonl, api/archive/ — are on NO cron at all and carry cron_installer_in_repo=null; they are produced by hand through scripts/run-anchor-pipeline.sh after an on-chain broadcast. The 21st, api/watch-status.json (added 2026-10-03), runs on the web host, not the validator host: it is written by scripts/external-watch.sh from a user-crontab block whose installer IS in this repo (scripts/install-web-host-external-watch.sh), so it carries cron_file=null and cron_installer_in_repo=true. Do not read this as 'push implies cron'.",
        "why_excluded": "A registry cannot govern text it cannot read. The spec (§9) records that 15 project cron files run in production and 7 have no repo installer; that count was measured on the host, not by this file, and is not re-measured here. What IS measured here is the repo side: the schedule, the arguments, and the environment that decide when and where a producer writes are outside this file for every push-owned publication. Do not read owner.producer as 'the registry controls this artifact' — it means only 'this script contains the write'."
      },
      {
        "surface": "The web host's forced-command receive wrapper (/home/<deploy user>/bin/receive-metal-push).",
        "measured": "Its flat-filename allowlist is operator-local and not in this repo. Only the subdirectory block is (scripts/deploy/receive-subdir-allowlist.snippet.sh), and tests/publication-registry/ checks that block's basename patterns against this file and against the sender.",
        "why_excluded": "Adding a name here and to the sender still leaves the receiver to be changed by hand on the host. A push whose name is new here will be rejected remotely until that happens."
      },
      {
        "surface": "Whether anything listed here is actually reachable at its public URL right now.",
        "measured": "Not measured. No HTTP request is made by this file or by its tests.",
        "why_excluded": "Phase 0 is offline and hermetic by construction. Liveness is the reconciler's job (spec §9), not the registry's."
      }
    ]
  },

  "publications": [
    {
      "path": "api/validator.json",
      "kind": "stream",
      "publisher": "push",
      "owner": {
        "producer": "scripts/node-info.sh",
        "producer_evidence": "scripts/node-info.sh:32 OUT=\"${ROOT}/public/api/validator.json\"",
        "runs_on": "validator-host",
        "cron_file": "metal-node-info",
        "cron_installer_in_repo": false
      },
      "push_name": "validator.json",
      "push_target": "/public/api/validator.json",
      "push_content_check": "JSON-validated",
      "rsync_delete_exclude": true,
      "gitignored": true,
      "git_tracked": false,
      "pinned_by": []
    },
    {
      "path": "api/server-status.json",
      "kind": "stream",
      "publisher": "push-out-of-band",
      "owner": {
        "producer": "scripts/server-status.sh",
        "producer_evidence": "scripts/server-status.sh:12 OUT=\"${OUT:-${REPO_BASE}/public/api/server-status.json}\"",
        "runs_on": "validator-host",
        "cron_file": "metal-server-status",
        "cron_installer_in_repo": false
      },
      "push_name": null,
      "rsync_delete_exclude": true,
      "gitignored": true,
      "git_tracked": false,
      "pinned_by": [],
      "note": "The one asymmetric entry: excluded from the deploy's --delete, but NOT on scripts/push-to-web-host.sh's allowlist. scripts/push-to-web-host.sh (header, 'Note:') states it is delivered by a different mechanism and does not name it. This file does not know what that mechanism is; it is not in the repo."
    },
    {
      "path": "api/peer-geo.json",
      "kind": "stream",
      "publisher": "push",
      "owner": {
        "producer": "scripts/peer-geo.py",